{
  "schema_version": "1.1.0",
  "interface": "TE-IFACE-CONTENT@1.1.0",
  "base_commit": "a1bf6689b9ba6a3c7077869ee03be1926b2e1c41",
  "interface_sha256": "7d682d883fc55b80ed3c5ea752ea942d94000942257dd93a3eddc22a66c36903",
  "content_sha256": "540623c9e7f973f0f1cfa4bd4aa5b27f5150247004a05b61ab3a8791b87e0a2e",
  "entries": [
    {
      "copy_key": "lane_a.opening.1",
      "claim_class": "FICTIONAL_FRAMING",
      "requires": [],
      "evidence_ids": [],
      "disposition": "AUDITED_BOUNDED_CANDIDATE",
      "rationale": "Office fiction supplies access or characterization, never historical proof."
    },
    {
      "copy_key": "lane_a.opening.2",
      "claim_class": "FICTIONAL_FRAMING",
      "requires": [],
      "evidence_ids": [],
      "disposition": "AUDITED_BOUNDED_CANDIDATE",
      "rationale": "Office fiction supplies access or characterization, never historical proof."
    },
    {
      "copy_key": "lane_a.opening.3",
      "claim_class": "FICTIONAL_FRAMING",
      "requires": [],
      "evidence_ids": [],
      "disposition": "AUDITED_BOUNDED_CANDIDATE",
      "rationale": "Office fiction supplies access or characterization, never historical proof."
    },
    {
      "copy_key": "lane_a.opening.4",
      "claim_class": "FICTIONAL_FRAMING",
      "requires": [],
      "evidence_ids": [],
      "disposition": "AUDITED_BOUNDED_CANDIDATE",
      "rationale": "Office fiction supplies access or characterization, never historical proof."
    },
    {
      "copy_key": "lane_a.opening.5",
      "claim_class": "FICTIONAL_FRAMING",
      "requires": [],
      "evidence_ids": [],
      "disposition": "AUDITED_BOUNDED_CANDIDATE",
      "rationale": "Office fiction supplies access or characterization, never historical proof."
    },
    {
      "copy_key": "lane_a.opening.6",
      "claim_class": "FICTIONAL_FRAMING",
      "requires": [],
      "evidence_ids": [],
      "disposition": "AUDITED_BOUNDED_CANDIDATE",
      "rationale": "Office fiction supplies access or characterization, never historical proof."
    },
    {
      "copy_key": "lane_a.opening.7",
      "claim_class": "FICTIONAL_FRAMING",
      "requires": [],
      "evidence_ids": [],
      "disposition": "AUDITED_BOUNDED_CANDIDATE",
      "rationale": "Office fiction supplies access or characterization, never historical proof."
    },
    {
      "copy_key": "lane_a.opening.8",
      "claim_class": "FICTIONAL_FRAMING",
      "requires": [],
      "evidence_ids": [],
      "disposition": "AUDITED_BOUNDED_CANDIDATE",
      "rationale": "Office fiction supplies access or characterization, never historical proof."
    },
    {
      "copy_key": "lane_a.beat.records.no_ordinary_witnesses",
      "claim_class": "METHOD_ONLY",
      "requires": [],
      "evidence_ids": [],
      "disposition": "AUDITED_BOUNDED_CANDIDATE",
      "rationale": "Procedural teaching, labels or recovery; no new historical result or runtime effect."
    },
    {
      "copy_key": "lane_a.beat.records.rook_assumes_no_leads",
      "claim_class": "METHOD_ONLY",
      "requires": [],
      "evidence_ids": [],
      "disposition": "AUDITED_BOUNDED_CANDIDATE",
      "rationale": "Procedural teaching, labels or recovery; no new historical result or runtime effect."
    },
    {
      "copy_key": "lane_a.beat.records.event_was_onchain",
      "claim_class": "METHOD_ONLY",
      "requires": [],
      "evidence_ids": [],
      "disposition": "AUDITED_BOUNDED_CANDIDATE",
      "rationale": "Procedural teaching, labels or recovery; no new historical result or runtime effect."
    },
    {
      "copy_key": "lane_a.beat.records.rook_misses_implication",
      "claim_class": "METHOD_ONLY",
      "requires": [],
      "evidence_ids": [],
      "disposition": "AUDITED_BOUNDED_CANDIDATE",
      "rationale": "Procedural teaching, labels or recovery; no new historical result or runtime effect."
    },
    {
      "copy_key": "lane_a.beat.records.public_but_hard_to_read",
      "claim_class": "METHOD_ONLY",
      "requires": [],
      "evidence_ids": [],
      "disposition": "AUDITED_BOUNDED_CANDIDATE",
      "rationale": "Procedural teaching, labels or recovery; no new historical result or runtime effect."
    },
    {
      "copy_key": "lane_a.beat.records.rook_premature_confidence",
      "claim_class": "METHOD_ONLY",
      "requires": [],
      "evidence_ids": [],
      "disposition": "AUDITED_BOUNDED_CANDIDATE",
      "rationale": "Procedural teaching, labels or recovery; no new historical result or runtime effect."
    },
    {
      "copy_key": "lane_a.beat.records.archivist_corrects_scope",
      "claim_class": "METHOD_ONLY",
      "requires": [],
      "evidence_ids": [],
      "disposition": "AUDITED_BOUNDED_CANDIDATE",
      "rationale": "Procedural teaching, labels or recovery; no new historical result or runtime effect."
    },
    {
      "copy_key": "lane_a.beat.records.authorized_case_access",
      "claim_class": "FICTIONAL_FRAMING",
      "requires": [],
      "evidence_ids": [],
      "disposition": "AUDITED_BOUNDED_CANDIDATE",
      "rationale": "Office fiction supplies access or characterization, never historical proof."
    },
    {
      "copy_key": "lane_a.beat.records.nansen_structures_not_solves",
      "claim_class": "METHOD_ONLY",
      "requires": [],
      "evidence_ids": [],
      "disposition": "AUDITED_BOUNDED_CANDIDATE",
      "rationale": "Procedural teaching, labels or recovery; no new historical result or runtime effect."
    },
    {
      "copy_key": "lane_a.beat.records.learn_together",
      "claim_class": "METHOD_ONLY",
      "requires": [],
      "evidence_ids": [],
      "disposition": "AUDITED_BOUNDED_CANDIDATE",
      "rationale": "Procedural teaching, labels or recovery; no new historical result or runtime effect."
    },
    {
      "copy_key": "lane_a.puzzle.pull-ticket.1",
      "claim_class": "FICTIONAL_FRAMING",
      "requires": [
        "PHASE.START"
      ],
      "evidence_ids": [],
      "disposition": "AUDITED_BOUNDED_CANDIDATE",
      "rationale": "Office fiction supplies access or characterization, never historical proof."
    },
    {
      "copy_key": "lane_a.puzzle.complete-request.1",
      "claim_class": "FICTIONAL_FRAMING",
      "requires": [
        "PHASE.TICKET_PULLED"
      ],
      "evidence_ids": [],
      "disposition": "AUDITED_BOUNDED_CANDIDATE",
      "rationale": "Office fiction supplies access or characterization, never historical proof."
    },
    {
      "copy_key": "lane_a.puzzle.stamp-request.1",
      "claim_class": "FICTIONAL_FRAMING",
      "requires": [
        "PHASE.REQUEST_COMPLETED"
      ],
      "evidence_ids": [],
      "disposition": "AUDITED_BOUNDED_CANDIDATE",
      "rationale": "Office fiction supplies access or characterization, never historical proof."
    },
    {
      "copy_key": "lane_a.puzzle.stamp-request.2",
      "claim_class": "FICTIONAL_FRAMING",
      "requires": [
        "PHASE.REQUEST_COMPLETED"
      ],
      "evidence_ids": [],
      "disposition": "AUDITED_BOUNDED_CANDIDATE",
      "rationale": "Office fiction supplies access or characterization, never historical proof."
    },
    {
      "copy_key": "lane_a.puzzle.load-tube.1",
      "claim_class": "FICTIONAL_FRAMING",
      "requires": [
        "PHASE.REQUEST_STAMPED"
      ],
      "evidence_ids": [],
      "disposition": "AUDITED_BOUNDED_CANDIDATE",
      "rationale": "Office fiction supplies access or characterization, never historical proof."
    },
    {
      "copy_key": "lane_a.puzzle.close-tube.1",
      "claim_class": "FICTIONAL_FRAMING",
      "requires": [
        "PHASE.REQUEST_IN_TUBE"
      ],
      "evidence_ids": [],
      "disposition": "AUDITED_BOUNDED_CANDIDATE",
      "rationale": "Office fiction supplies access or characterization, never historical proof."
    },
    {
      "copy_key": "lane_a.puzzle.dispatch-request.1",
      "claim_class": "FICTIONAL_FRAMING",
      "requires": [
        "PHASE.TUBE_CLOSED"
      ],
      "evidence_ids": [],
      "disposition": "AUDITED_BOUNDED_CANDIDATE",
      "rationale": "Office fiction supplies access or characterization, never historical proof."
    },
    {
      "copy_key": "lane_a.puzzle.open-canister.1",
      "claim_class": "FICTIONAL_FRAMING",
      "requires": [
        "PHASE.DISPATCHED"
      ],
      "evidence_ids": [],
      "disposition": "AUDITED_BOUNDED_CANDIDATE",
      "rationale": "Office fiction supplies access or characterization, never historical proof."
    },
    {
      "copy_key": "lane_a.puzzle.take-strip.1",
      "claim_class": "FICTIONAL_FRAMING",
      "requires": [
        "PHASE.CANISTER_OPEN"
      ],
      "evidence_ids": [],
      "disposition": "AUDITED_BOUNDED_CANDIDATE",
      "rationale": "Office fiction supplies access or characterization, never historical proof."
    },
    {
      "copy_key": "lane_a.puzzle.unlock-terminal.1",
      "claim_class": "FICTIONAL_FRAMING",
      "requires": [
        "PHASE.STRIP_TAKEN"
      ],
      "evidence_ids": [],
      "disposition": "AUDITED_BOUNDED_CANDIDATE",
      "rationale": "Office fiction supplies access or characterization, never historical proof."
    },
    {
      "copy_key": "lane_a.puzzle.read-record.1",
      "claim_class": "FICTIONAL_FRAMING",
      "requires": [
        "PHASE.TERMINAL_UNLOCKED"
      ],
      "evidence_ids": [],
      "disposition": "AUDITED_BOUNDED_CANDIDATE",
      "rationale": "Office fiction supplies access or characterization, never historical proof."
    },
    {
      "copy_key": "lane_a.puzzle.reread-record.1",
      "claim_class": "FICTIONAL_FRAMING",
      "requires": [
        "PHASE.COMPLETE"
      ],
      "evidence_ids": [],
      "disposition": "AUDITED_BOUNDED_CANDIDATE",
      "rationale": "Office fiction supplies access or characterization, never historical proof."
    },
    {
      "copy_key": "lane_a.inventory.blank-request.name",
      "claim_class": "FICTIONAL_FRAMING",
      "requires": [],
      "evidence_ids": [],